202211listing,
Field,Value
Product Title,"Ceramic Incense Holder for Sticks - Incense Burner Holder Zen Decor - Decorative Bowl for Table D¨¦cor Design - 5.3"" W X 3.9"" H"
Bullet Point 0,"Create: The incense holder bowl home fragrance creates a modern aesthetics, incorporating traditional oriental culture, incense sticks stay upright while burning, simple and elegant to use."
Bullet Point 1,"Design: The minimalist incense holder prevents your incense ashes from scattering around, it offers an aesthetic option that you can easily use in your environment with its simple tone."
Bullet Point 2,"Material: Cast and handicraft by ceramic, the surface is coated with water-base non-toxic paint, has a sturdy, smooth touch. The incense holder made of durable solid brass, will not burn and easy to clean."
Bullet Point 3,"Multifunction: This Decorative Bowl for Table D¨¦cor can also be used as a small bowl for jewelry organizer, earring organizer, bracelet display, crystal holder, key holder, candle holder, etc."
Bullet Point 4,"Occasion: An ideal gift for those who love Aromatherapy, Yoga, Reiki, Massage and Meditation. Perfect gift for family and friends. Also can be used as home and office decor, bookshelf decor."
Bullet Point 5,"Size: This unique home decor is 5.3"" W X 3.9"" H / 13.5cm W X 10cm H, the opening of the brass incense holder is 0.1inch/ 2.5mm, suitable for multiple sizes of incense sticks, which is made of solid brass and weights 20g."
Bullet Point 6,"Note: This incense burner is made of ceramic, if it is damaged during transportation, please contact us for replacement, we will reply within 24 hours."
Description,"Incense, which has found a place in the rituals of different cultures from the past to the present, is mostly used while meditating today. While it is used as a healing in ancient Mesopotamian civilizations, it is used in many religious ceremonies in Hinduism. It is also known that the smell of incense causes the secretion of serotonin, known as the happiness hormone, while reducing stress and anxiety. Incense stick holder box can be in the form of a simple bowl, depending on the form of the incense to be burned, or in a variety of forms with a hole on it. The incense holder made of ceramic is very suitable and durable for your stick incense. While the wide part of the Hamsa prevents your incense ashes from scattering around, it offers an aesthetic option that you can easily use in your environment with its dark tone. This cool incense holder can be also used as crystal holder for stones display."
Search Terms,alt accessories coquette aesthetic room decor cottagecore decor evil eye decor western decor witchy decor boho sanskriti boho table decor boujee room decor feng shui insense holder insense burner insencens burner insent. holder turkish decor
Subject Matter 0,alt accessories coquette aesthetic room decor?
Subject Matter 1,cottagecore decor evil eye decor western decor
Subject Matter 2,witchy decor boho sanskriti boho table decor?
Subject Matter 3,boujee room decor feng shui insense holder burner
Subject Matter 4,insencens burner insent. holder turkish decor
