202204listing,
Field,Value
Product Title,Spooky Tealight Candle Holder - Halloween Decorations Horror Skeleton Skull Candle Holders - Resin Candlestick Gothic Style Home Decor for Bedroom Living Room (White)
Bullet Point 0,"High Quality Material: It is made of high-quality resin material, which is durable and can extend the service life."
Bullet Point 1,"Exquisite Craftsmanship: The exquisite workmanship of spooky skeleton shape, suitable for the Halloween gothic kind of atmosphere."
Bullet Point 2,"Funny Decoration: The novel candlestick shape is also a perfect home decoration, suitable for living room, bedroom, study, garden, office, shop, hotel decoration."
Bullet Point 3,Candle Holder: The position of the hand can be used as a tea light candle holder or for electronic candles. (None included)
Bullet Point 4,"Widely Used: Suitable for Halloween decoration, gothic theme party, haunted house environment."
Bullet Point 5,
Bullet Point 6,
Description,"HALLOWEEN SKELETON CANDLE HOLDER
A skeleton hand holding a skull, creates a scary and horror atmosphere for the family during Halloween. Suitable for decorating Halloween parties, haunted houses, gardens or yards, and adding a creepy look to your Halloween festival.
Perfect decoration for Halloween, birthday party, home, office, patio, candlelight dinner, table centerpieces, dining room, living room, coffee table, restaurant, bar, etc.
The decorative resin skull candle holder stand will be a gift to your friends or family for Halloween, holidays, birthdays, New Year, etc."
Search Terms,zip lock organizador de bolsas plasticas gavetas para organizar stretch tite cling film magnetic plastic box wrap reusable food wrapper dispenser trash bag dispenser kitchen roll holder plastic paper cutter box
